{
  "schema_version": "1.0.0",
  "record_type": "publication_event",
  "id": "publish-resolution-pathway-and-tissue-repair-bootstrap-2026-06-02-2026-06-03t10-38-26-730z",
  "name": "Published Resolution pathway and tissue repair baseline review for June 2, 2026",
  "summary": "Submitted baseline-review update establishing the first public baseline candidate for the resolution pathway and tissue repair track.",
  "candidate_bundle_id": "resolution-pathway-and-tissue-repair-bootstrap-2026-06-02",
  "event_type": "publish",
  "published_at": "2026-06-03T10:38:26.730Z",
  "published_by": "tyler",
  "published_targets": [
    {
      "record_type": "intervention",
      "record_id": "resolvin-d1",
      "action": "created"
    },
    {
      "record_type": "intervention",
      "record_id": "maresin-1",
      "action": "created"
    },
    {
      "record_type": "intervention",
      "record_id": "spm-enriched-marine-oil",
      "action": "created"
    },
    {
      "record_type": "intervention",
      "record_id": "epa-dha-oral-supplementation",
      "action": "created"
    },
    {
      "record_type": "source",
      "record_id": "pmid-25217168",
      "action": "created"
    },
    {
      "record_type": "source",
      "record_id": "pmid-34075679",
      "action": "created"
    },
    {
      "record_type": "source",
      "record_id": "pmid-32794246",
      "action": "created"
    },
    {
      "record_type": "source",
      "record_id": "pmid-31829100",
      "action": "created"
    },
    {
      "record_type": "source",
      "record_id": "nct-03347006",
      "action": "created"
    },
    {
      "record_type": "source",
      "record_id": "pmid-35349683",
      "action": "created"
    },
    {
      "record_type": "source",
      "record_id": "nct-04701138",
      "action": "created"
    },
    {
      "record_type": "source",
      "record_id": "pmid-32696697",
      "action": "created"
    },
    {
      "record_type": "source",
      "record_id": "nct-02719665",
      "action": "created"
    },
    {
      "record_type": "source",
      "record_id": "pmid-29735019",
      "action": "created"
    },
    {
      "record_type": "source",
      "record_id": "doi-10.1111-wrr.12558",
      "action": "created"
    },
    {
      "record_type": "source",
      "record_id": "nct-03576989",
      "action": "created"
    },
    {
      "record_type": "study",
      "record_id": "aged-resolution-nano-proresolving-medicines",
      "action": "created"
    },
    {
      "record_type": "study",
      "record_id": "rvd1-aged-muscle-injury-regeneration",
      "action": "created"
    },
    {
      "record_type": "study",
      "record_id": "maresin1-aged-fracture-healing-mice",
      "action": "created"
    },
    {
      "record_type": "study",
      "record_id": "spm-enriched-marine-oil-healthy-volunteers",
      "action": "created"
    },
    {
      "record_type": "study",
      "record_id": "spm-active-obesity-bioavailability",
      "action": "created"
    },
    {
      "record_type": "study",
      "record_id": "spm-emulsion-pad-healthy-volunteers",
      "action": "created"
    },
    {
      "record_type": "study",
      "record_id": "epa-dha-chronic-venous-leg-ulcer-pilot",
      "action": "created"
    },
    {
      "record_type": "study",
      "record_id": "epa-dha-cvlu-older-adults-registry",
      "action": "created"
    },
    {
      "record_type": "finding",
      "record_id": "aged-mice-resolution-deficit-rescued-by-nano-proresolving-medicines",
      "action": "created"
    },
    {
      "record_type": "finding",
      "record_id": "rvd1-improved-aged-muscle-functional-recovery",
      "action": "created"
    },
    {
      "record_type": "finding",
      "record_id": "maresin1-improved-aged-bone-fracture-healing",
      "action": "created"
    },
    {
      "record_type": "finding",
      "record_id": "enriched-marine-oil-raised-human-spms-immune-responses",
      "action": "created"
    },
    {
      "record_type": "finding",
      "record_id": "spm-active-increased-select-spms-obesity",
      "action": "created"
    },
    {
      "record_type": "finding",
      "record_id": "marine-oil-pad-altered-lipid-mediators-leukocyte-phenotype",
      "action": "created"
    },
    {
      "record_type": "finding",
      "record_id": "epa-dha-lowered-cytokines-aging-cvlu-adults",
      "action": "created"
    },
    {
      "record_type": "finding",
      "record_id": "epa-dha-reduced-cvlu-pmn-activation-wound-area-trend",
      "action": "created"
    },
    {
      "record_type": "finding",
      "record_id": "completed-omega3-cvlu-trial-no-posted-results",
      "action": "created"
    },
    {
      "record_type": "outlook",
      "record_id": "track-resolution-pathway-and-tissue-repair-outlook",
      "action": "created"
    }
  ],
  "affected_outlook_ids": [
    "track-resolution-pathway-and-tissue-repair-outlook",
    "hallmark-chronic-inflammation-outlook"
  ],
  "approving_evidence_review_ids": [
    "evidence-review-resolution-pathway-and-tissue-repair-interpretation-forecast-r1",
    "evidence-review-resolution-pathway-and-tissue-repair-source-fidelity-r1"
  ],
  "change_note": "Create the first public track outlook at a tentative human biomarker signal because human SPM and omega-3 studies support target engagement and inflammatory-resolution biomarkers, while direct tissue repair efficacy remains animal-level or unconfirmed."
}
