{
  "schema_version": "1.0.0",
  "record_type": "publication_event",
  "id": "publish-extracellular-vesicle-and-secretome-therapies-bootstrap-2026-06-01-2026-06-01t20-58-42-912z",
  "name": "Published Extracellular vesicle and secretome therapies baseline review for June 1, 2026",
  "summary": "Submitted baseline-review update establishing the first public baseline for the extracellular vesicle and secretome therapies track.",
  "candidate_bundle_id": "extracellular-vesicle-and-secretome-therapies-bootstrap-2026-06-01",
  "event_type": "publish",
  "published_at": "2026-06-01T20:58:42.912Z",
  "published_by": "tyler",
  "published_targets": [
    {
      "record_type": "source",
      "record_id": "pmid-33728821",
      "action": "created"
    },
    {
      "record_type": "source",
      "record_id": "pmid-25324650",
      "action": "created"
    },
    {
      "record_type": "source",
      "record_id": "pmid-36396862",
      "action": "created"
    },
    {
      "record_type": "source",
      "record_id": "pmid-37377400",
      "action": "created"
    },
    {
      "record_type": "source",
      "record_id": "pmid-37859748",
      "action": "created"
    },
    {
      "record_type": "source",
      "record_id": "pmid-37353884",
      "action": "created"
    },
    {
      "record_type": "source",
      "record_id": "pmid-39465400",
      "action": "created"
    },
    {
      "record_type": "source",
      "record_id": "pmid-40500748",
      "action": "created"
    },
    {
      "record_type": "study",
      "record_id": "msc-evs-aging-mouse-models",
      "action": "created"
    },
    {
      "record_type": "study",
      "record_id": "hesc-epc-conditioned-medium-skin-aging-split-face",
      "action": "created"
    },
    {
      "record_type": "study",
      "record_id": "conditioned-medium-skin-aging-rct-meta-analysis",
      "action": "created"
    },
    {
      "record_type": "study",
      "record_id": "adipose-exosome-solution-skin-aging-split-face",
      "action": "created"
    },
    {
      "record_type": "study",
      "record_id": "adipose-msc-exosomes-alzheimers-phase1-2",
      "action": "created"
    },
    {
      "record_type": "study",
      "record_id": "platelet-ev-wound-healing-phase1",
      "action": "created"
    },
    {
      "record_type": "study",
      "record_id": "placental-msc-ev-knee-osteoarthritis-rct",
      "action": "created"
    },
    {
      "record_type": "study",
      "record_id": "huc-msc-exosome-knee-osteoarthritis-dose-study",
      "action": "created"
    },
    {
      "record_type": "finding",
      "record_id": "msc-evs-extended-healthspan-mouse-aging",
      "action": "created"
    },
    {
      "record_type": "finding",
      "record_id": "hesc-conditioned-medium-improved-human-skin-aging",
      "action": "created"
    },
    {
      "record_type": "finding",
      "record_id": "conditioned-medium-meta-analysis-supported-skin-aging",
      "action": "created"
    },
    {
      "record_type": "finding",
      "record_id": "adipose-exosome-solution-improved-skin-aging",
      "action": "created"
    },
    {
      "record_type": "finding",
      "record_id": "adipose-msc-exosomes-ad-safety-exploratory-cognition",
      "action": "created"
    },
    {
      "record_type": "finding",
      "record_id": "platelet-evs-safe-no-wound-closure-advantage",
      "action": "created"
    },
    {
      "record_type": "finding",
      "record_id": "placental-msc-evs-null-knee-oa-rct",
      "action": "created"
    },
    {
      "record_type": "finding",
      "record_id": "huc-msc-exosomes-oa-pilot-dose-signal",
      "action": "created"
    },
    {
      "record_type": "outlook",
      "record_id": "track-extracellular-vesicle-and-secretome-therapies-outlook",
      "action": "created"
    }
  ],
  "affected_outlook_ids": [
    "track-extracellular-vesicle-and-secretome-therapies-outlook"
  ],
  "approving_evidence_review_ids": [
    "evidence-review-extracellular-vesicle-and-secretome-therapies-interpretation-forecast-r1",
    "evidence-review-extracellular-vesicle-and-secretome-therapies-source-fidelity-r1"
  ],
  "change_note": "Create the first public track outlook at human_biomarker_signal with accelerating momentum and low confidence because controlled human evidence is concentrated in skin-aging biomarkers, while disease-specific function remains exploratory or null and direct aging support is still preclinical."
}
