{
  "schema_version": "1.0.0",
  "record_type": "publication_event",
  "id": "publish-stem-cell-rejuvenation-bootstrap-2026-05-31-2026-05-31t16-42-37-038z",
  "name": "Published Stem cell rejuvenation baseline review for May 31, 2026",
  "summary": "Submitted baseline-review update establishing the first public baseline for the stem cell rejuvenation track.",
  "candidate_bundle_id": "stem-cell-rejuvenation-bootstrap-2026-05-31",
  "event_type": "publish",
  "published_at": "2026-05-31T16:42:37.038Z",
  "published_by": "tyler",
  "published_targets": [
    {
      "record_type": "source",
      "record_id": "pmid-33440922",
      "action": "created"
    },
    {
      "record_type": "source",
      "record_id": "pmid-22560076",
      "action": "created"
    },
    {
      "record_type": "source",
      "record_id": "pmid-32755011",
      "action": "created"
    },
    {
      "record_type": "source",
      "record_id": "pmid-27127236",
      "action": "created"
    },
    {
      "record_type": "source",
      "record_id": "pmid-24531378",
      "action": "created"
    },
    {
      "record_type": "source",
      "record_id": "pmid-36266373",
      "action": "created"
    },
    {
      "record_type": "study",
      "record_id": "human-hsc-cdc42-casin-ex-vivo",
      "action": "created"
    },
    {
      "record_type": "study",
      "record_id": "cdc42-casin-aged-hsc-rejuvenation-mice",
      "action": "created"
    },
    {
      "record_type": "study",
      "record_id": "systemic-casin-aged-mouse-lifespan",
      "action": "created"
    },
    {
      "record_type": "study",
      "record_id": "nad-repletion-aged-mouse-stem-cell-function",
      "action": "created"
    },
    {
      "record_type": "study",
      "record_id": "p38-inhibition-aged-musc-regeneration",
      "action": "created"
    },
    {
      "record_type": "study",
      "record_id": "exercise-pax7-satellite-cell-human-meta",
      "action": "created"
    },
    {
      "record_type": "finding",
      "record_id": "human-hsc-cdc42-casin-repolarization",
      "action": "created"
    },
    {
      "record_type": "finding",
      "record_id": "cdc42-inhibition-rejuvenated-aged-mouse-hsc",
      "action": "created"
    },
    {
      "record_type": "finding",
      "record_id": "systemic-casin-extended-aged-mouse-lifespan",
      "action": "created"
    },
    {
      "record_type": "finding",
      "record_id": "nr-rejuvenated-aged-mouse-stem-cells",
      "action": "created"
    },
    {
      "record_type": "finding",
      "record_id": "p38-inhibition-restored-aged-musc-regeneration",
      "action": "created"
    },
    {
      "record_type": "finding",
      "record_id": "exercise-increased-human-pax7-satellite-cells",
      "action": "created"
    },
    {
      "record_type": "outlook",
      "record_id": "track-stem-cell-rejuvenation-outlook",
      "action": "created"
    }
  ],
  "affected_outlook_ids": [
    "track-stem-cell-rejuvenation-outlook"
  ],
  "approving_evidence_review_ids": [
    "evidence-review-stem-cell-rejuvenation-interpretation-forecast-r1",
    "evidence-review-stem-cell-rejuvenation-source-fidelity-r1"
  ],
  "change_note": "Create the first public track outlook at human biomarker signal with steady momentum and a tentative read because human evidence is ex vivo or biomarker-level while functional evidence remains preclinical."
}
