{
  "schema_version": "1.0.0",
  "record_type": "publication_event",
  "id": "publish-dna-methylation-and-epigenome-restoration-bootstrap-2026-05-31-2026-06-01t00-02-21-706z",
  "name": "Published DNA methylation and epigenome restoration bootstrap for May 31, 2026",
  "summary": "Submitted bootstrap bundle establishing the first public baseline for the DNA methylation and epigenome restoration track.",
  "candidate_bundle_id": "dna-methylation-and-epigenome-restoration-bootstrap-2026-05-31",
  "event_type": "publish",
  "published_at": "2026-06-01T00:02:21.706Z",
  "published_by": "tyler",
  "published_targets": [
    {
      "record_type": "source",
      "record_id": "pmid-31496122",
      "action": "created"
    },
    {
      "record_type": "source",
      "record_id": "pmid-33844651",
      "action": "created"
    },
    {
      "record_type": "source",
      "record_id": "pmid-34847066",
      "action": "created"
    },
    {
      "record_type": "source",
      "record_id": "pmid-37118425",
      "action": "created"
    },
    {
      "record_type": "source",
      "record_id": "pmid-39900648",
      "action": "created"
    },
    {
      "record_type": "source",
      "record_id": "pmid-41803341",
      "action": "created"
    },
    {
      "record_type": "source",
      "record_id": "nct-04375657",
      "action": "created"
    },
    {
      "record_type": "study",
      "record_id": "triim-human-epigenetic-aging-pilot",
      "action": "created"
    },
    {
      "record_type": "study",
      "record_id": "methylation-diet-lifestyle-pilot-rct",
      "action": "created"
    },
    {
      "record_type": "study",
      "record_id": "rejuvant-dnam-age-retrospective-cohort",
      "action": "created"
    },
    {
      "record_type": "study",
      "record_id": "calerie-caloric-restriction-dnam-aging",
      "action": "created"
    },
    {
      "record_type": "study",
      "record_id": "do-health-omega3-vitd-exercise-dnam-clocks",
      "action": "created"
    },
    {
      "record_type": "study",
      "record_id": "cosmos-mvm-cocoa-epigenetic-clocks",
      "action": "created"
    },
    {
      "record_type": "study",
      "record_id": "triim-x-extension-registry",
      "action": "created"
    },
    {
      "record_type": "finding",
      "record_id": "triim-human-epigenetic-age-decrease",
      "action": "created"
    },
    {
      "record_type": "finding",
      "record_id": "methylation-diet-lifestyle-horvath-age-decrease",
      "action": "created"
    },
    {
      "record_type": "finding",
      "record_id": "rejuvant-retrospective-dnam-age-decrease",
      "action": "created"
    },
    {
      "record_type": "finding",
      "record_id": "calerie-cr-slowed-dunedinpace",
      "action": "created"
    },
    {
      "record_type": "finding",
      "record_id": "do-health-omega3-small-dnam-clock-slowing",
      "action": "created"
    },
    {
      "record_type": "finding",
      "record_id": "cosmos-mvm-small-epigenetic-clock-slowing",
      "action": "created"
    },
    {
      "record_type": "finding",
      "record_id": "triim-x-registry-no-results",
      "action": "created"
    },
    {
      "record_type": "finding",
      "record_id": "casin-reduced-blood-dnam-age-aged-mice",
      "action": "created"
    },
    {
      "record_type": "outlook",
      "record_id": "track-dna-methylation-and-epigenome-restoration-outlook",
      "action": "created"
    }
  ],
  "affected_outlook_ids": [
    "track-dna-methylation-and-epigenome-restoration-outlook",
    "hallmark-epigenetic-alterations-outlook"
  ],
  "approving_evidence_review_ids": [
    "evidence-review-dna-methylation-and-epigenome-restoration-interpretation-forecast-r1",
    "evidence-review-dna-methylation-and-epigenome-restoration-source-fidelity-r1"
  ],
  "change_note": "Creates the first public baseline at human_biomarker_signal with steady momentum and low confidence."
}
