{
  "schema_version": "1.0.0",
  "record_type": "publication_event",
  "id": "publish-immune-rejuvenation-update-2026-05-30-2026-05-30t23-01-21-056z",
  "name": "Published Immune rejuvenation update for May 30, 2026",
  "summary": "Submitted bundle proposing a stronger public summary for a clinically legible track.",
  "candidate_bundle_id": "immune-rejuvenation-update-2026-05-30",
  "event_type": "publish",
  "published_at": "2026-05-30T23:01:21.056Z",
  "published_by": "tyler",
  "published_targets": [
    {
      "record_type": "outlook",
      "record_id": "track-immune-rejuvenation-outlook",
      "action": "updated"
    }
  ],
  "affected_outlook_ids": [
    "track-immune-rejuvenation-outlook"
  ],
  "approving_evidence_review_ids": [
    "evidence-review-immune-rejuvenation-source-fidelity-r1",
    "evidence-review-immune-rejuvenation-interpretation-r1"
  ],
  "change_note": "The track may deserve more prominence, but not necessarily a stage move."
}
