{
  "schema_version": "1.0.0",
  "record_type": "publication_event",
  "id": "publish-partial-reprogramming-update-2026-05-29-2026-05-31t13-30-12-515z",
  "name": "Published Partial reprogramming review update for May 29, 2026",
  "summary": "In-review bundle intended to refine the public wording around human-testing risk.",
  "candidate_bundle_id": "partial-reprogramming-update-2026-05-29",
  "event_type": "publish",
  "published_at": "2026-05-31T13:30:12.515Z",
  "published_by": "tyler",
  "published_targets": [
    {
      "record_type": "outlook",
      "record_id": "track-partial-reprogramming-outlook",
      "action": "updated"
    }
  ],
  "affected_outlook_ids": [
    "track-partial-reprogramming-outlook"
  ],
  "approving_evidence_review_ids": [
    "evidence-review-partial-reprogramming-interpretation-forecast-r2-round-3",
    "evidence-review-partial-reprogramming-source-fidelity-r2"
  ],
  "change_note": "No stage move is proposed. The change is interpretive discipline, not a stronger signal."
}
