{
  "schema_version": "1.0.0",
  "record_type": "publication_event",
  "id": "publish-mitophagy-enhancers-coverage-repair-2026-06-10-2026-06-10t14-26-07-178z",
  "name": "Published Mitophagy Enhancers Missing-Context Update for June 10, 2026",
  "summary": "Missing-context update that adds urolithin A safety and limiting-context sources, stages the most relevant active or completed no-results urolithin A registries, refreshes registry metadata for published trials, and updates the Mitophagy Enhancers outlook evidence map while keeping the track at tentative human_biomarker_signal.",
  "candidate_bundle_id": "mitophagy-enhancers-coverage-repair-2026-06-10",
  "event_type": "publish",
  "published_at": "2026-06-10T14:26:07.178Z",
  "published_by": "tyler",
  "published_targets": [
    {
      "record_type": "source",
      "record_id": "pmid-42058113",
      "action": "created"
    },
    {
      "record_type": "study",
      "record_id": "urolithin-a-renal-calculi-case-series",
      "action": "created"
    },
    {
      "record_type": "finding",
      "record_id": "urolithin-a-renal-calculi-safety-signal",
      "action": "created"
    },
    {
      "record_type": "source",
      "record_id": "pmid-40839339",
      "action": "created"
    },
    {
      "record_type": "study",
      "record_id": "urolithin-a-trained-runners-performance-recovery",
      "action": "created"
    },
    {
      "record_type": "finding",
      "record_id": "urolithin-a-trained-runners-recovery-no-performance-benefit",
      "action": "created"
    },
    {
      "record_type": "source",
      "record_id": "nct-06274749",
      "action": "created"
    },
    {
      "record_type": "study",
      "record_id": "urolithin-a-glucose-metabolism-older-adults-registry",
      "action": "created"
    },
    {
      "record_type": "finding",
      "record_id": "urolithin-a-older-adult-glucose-metabolism-registry-recruiting-no-results",
      "action": "created"
    },
    {
      "record_type": "source",
      "record_id": "nct-07231783",
      "action": "created"
    },
    {
      "record_type": "study",
      "record_id": "urolithin-a-middle-aged-muscle-strength-registry",
      "action": "created"
    },
    {
      "record_type": "finding",
      "record_id": "urolithin-a-middle-aged-strength-registry-recruiting-no-results",
      "action": "created"
    },
    {
      "record_type": "source",
      "record_id": "nct-05921266",
      "action": "created"
    },
    {
      "record_type": "study",
      "record_id": "urolithin-a-obesity-vascular-mitochondrial-registry",
      "action": "created"
    },
    {
      "record_type": "finding",
      "record_id": "urolithin-a-obesity-vascular-registry-completed-no-results",
      "action": "created"
    },
    {
      "record_type": "source",
      "record_id": "nct-06556706",
      "action": "updated"
    },
    {
      "record_type": "study",
      "record_id": "urolithin-a-frail-older-adults-registry",
      "action": "updated"
    },
    {
      "record_type": "finding",
      "record_id": "completed-frail-urolithin-a-trial-no-results",
      "action": "updated"
    },
    {
      "record_type": "study",
      "record_id": "energize-urolithin-a-older-adults",
      "action": "updated"
    },
    {
      "record_type": "study",
      "record_id": "atlas-urolithin-a-middle-aged-adults",
      "action": "updated"
    },
    {
      "record_type": "study",
      "record_id": "mitoimmune-urolithin-a-immune-aging",
      "action": "updated"
    },
    {
      "record_type": "outlook",
      "record_id": "track-mitophagy-enhancers-outlook",
      "action": "updated"
    }
  ],
  "affected_outlook_ids": [
    "track-mitophagy-enhancers-outlook"
  ],
  "approving_evidence_review_ids": [
    "evidence-review-mitophagy-enhancers-coverage-repair-2026-06-10-interpretation-forecast-r1",
    "evidence-review-mitophagy-enhancers-coverage-repair-2026-06-10-safety-limitations-r1",
    "evidence-review-mitophagy-enhancers-coverage-repair-2026-06-10-source-fidelity-r1",
    "evidence-review-mitophagy-enhancers-coverage-repair-2026-06-10-taxonomy-mapping-r1"
  ],
  "change_note": "Keep human_biomarker_signal, steady momentum, and a tentative read. The staged repair improves safety, registry, limiting-context, and evidence-map coverage but adds no long-lasting improvement in older-human function."
}
