{
  "schema_version": "1.0.0",
  "record_type": "publication_event",
  "id": "publish-protein-aggregate-clearance-bootstrap-2026-06-02-2026-06-02t12-29-42-280z",
  "name": "Published Protein aggregate clearance baseline review for June 2, 2026",
  "summary": "Submitted baseline-review update establishing the first public baseline candidate for the protein aggregate clearance track.",
  "candidate_bundle_id": "protein-aggregate-clearance-bootstrap-2026-06-02",
  "event_type": "publish",
  "published_at": "2026-06-02T12:29:42.280Z",
  "published_by": "tyler",
  "published_targets": [
    {
      "record_type": "source",
      "record_id": "pmid-36449413",
      "action": "created"
    },
    {
      "record_type": "source",
      "record_id": "pmid-37459141",
      "action": "created"
    },
    {
      "record_type": "source",
      "record_id": "pmid-37212440",
      "action": "created"
    },
    {
      "record_type": "source",
      "record_id": "pmid-41212997",
      "action": "created"
    },
    {
      "record_type": "source",
      "record_id": "pmid-37888916",
      "action": "created"
    },
    {
      "record_type": "source",
      "record_id": "pmid-30145929",
      "action": "created"
    },
    {
      "record_type": "source",
      "record_id": "pmid-38197816",
      "action": "created"
    },
    {
      "record_type": "source",
      "record_id": "pmid-39213194",
      "action": "created"
    },
    {
      "record_type": "study",
      "record_id": "clarity-ad-lecanemab-early-alzheimers",
      "action": "created"
    },
    {
      "record_type": "study",
      "record_id": "trailblazer-alz2-donanemab-early-alzheimers",
      "action": "created"
    },
    {
      "record_type": "study",
      "record_id": "ni006-attr-cm-phase1",
      "action": "created"
    },
    {
      "record_type": "study",
      "record_id": "coramitug-attr-cm-phase2",
      "action": "created"
    },
    {
      "record_type": "study",
      "record_id": "apollo-b-patisiran-attr-cm",
      "action": "created"
    },
    {
      "record_type": "study",
      "record_id": "attr-act-tafamidis-attr-cm",
      "action": "created"
    },
    {
      "record_type": "study",
      "record_id": "attribute-cm-acoramidis",
      "action": "created"
    },
    {
      "record_type": "study",
      "record_id": "helios-b-vutrisiran-attr-cm",
      "action": "created"
    },
    {
      "record_type": "finding",
      "record_id": "lecanemab-reduced-amyloid-and-slowed-early-ad-decline",
      "action": "created"
    },
    {
      "record_type": "finding",
      "record_id": "donanemab-cleared-amyloid-and-slowed-early-ad-decline",
      "action": "created"
    },
    {
      "record_type": "finding",
      "record_id": "ni006-reduced-attr-cm-amyloid-load-biomarkers",
      "action": "created"
    },
    {
      "record_type": "finding",
      "record_id": "coramitug-reduced-ntprobnp-without-6mwt-benefit",
      "action": "created"
    },
    {
      "record_type": "finding",
      "record_id": "patisiran-preserved-6mwt-attr-cm",
      "action": "created"
    },
    {
      "record_type": "finding",
      "record_id": "tafamidis-reduced-attr-cm-mortality-hospitalizations",
      "action": "created"
    },
    {
      "record_type": "finding",
      "record_id": "acoramidis-improved-attr-cm-hierarchical-outcome",
      "action": "created"
    },
    {
      "record_type": "finding",
      "record_id": "vutrisiran-reduced-attr-cm-death-cv-events",
      "action": "created"
    },
    {
      "record_type": "intervention",
      "record_id": "lecanemab",
      "action": "created"
    },
    {
      "record_type": "intervention",
      "record_id": "donanemab",
      "action": "created"
    },
    {
      "record_type": "intervention",
      "record_id": "ni006",
      "action": "created"
    },
    {
      "record_type": "intervention",
      "record_id": "coramitug",
      "action": "created"
    },
    {
      "record_type": "intervention",
      "record_id": "patisiran",
      "action": "created"
    },
    {
      "record_type": "intervention",
      "record_id": "tafamidis",
      "action": "created"
    },
    {
      "record_type": "intervention",
      "record_id": "acoramidis",
      "action": "created"
    },
    {
      "record_type": "intervention",
      "record_id": "vutrisiran",
      "action": "created"
    },
    {
      "record_type": "outlook",
      "record_id": "track-protein-aggregate-clearance-outlook",
      "action": "created"
    }
  ],
  "affected_outlook_ids": [
    "track-protein-aggregate-clearance-outlook",
    "hallmark-loss-of-proteostasis-outlook"
  ],
  "approving_evidence_review_ids": [
    "evidence-review-protein-aggregate-clearance-interpretation-forecast-r1",
    "evidence-review-protein-aggregate-clearance-source-fidelity-r1"
  ],
  "change_note": "A first public baseline is justified at low-confidence durable_disease_or_mortality_relevance because ATTR-CM has randomized mortality, morbidity, and cardiovascular-event evidence and Alzheimer's amyloid-removal antibodies show direct pathology lowering with modest clinical slowing."
}
