{
  "schema_version": "1.0.0",
  "record_type": "publication_event",
  "id": "publish-ecosystem-replacement-bootstrap-2026-06-03-2026-06-03t14-40-25-040z",
  "name": "Published Ecosystem replacement baseline review for June 3, 2026",
  "summary": "Baseline-review update establishing the first public baseline candidate for the ecosystem replacement track.",
  "candidate_bundle_id": "ecosystem-replacement-bootstrap-2026-06-03",
  "event_type": "publish",
  "published_at": "2026-06-03T14:40:25.040Z",
  "published_by": "tyler",
  "published_targets": [
    {
      "record_type": "source",
      "record_id": "pmid-28826469",
      "action": "created"
    },
    {
      "record_type": "source",
      "record_id": "pmid-31332389",
      "action": "created"
    },
    {
      "record_type": "source",
      "record_id": "pmid-35501923",
      "action": "created"
    },
    {
      "record_type": "source",
      "record_id": "pmid-38739944",
      "action": "created"
    },
    {
      "record_type": "source",
      "record_id": "pmid-39812540",
      "action": "created"
    },
    {
      "record_type": "source",
      "record_id": "pmid-40444969",
      "action": "created"
    },
    {
      "record_type": "source",
      "record_id": "pmid-22728514",
      "action": "created"
    },
    {
      "record_type": "source",
      "record_id": "pmid-27134658",
      "action": "created"
    },
    {
      "record_type": "source",
      "record_id": "pmid-36109637",
      "action": "created"
    },
    {
      "record_type": "source",
      "record_id": "nct-05598112",
      "action": "created"
    },
    {
      "record_type": "source",
      "record_id": "nct-06649981",
      "action": "created"
    },
    {
      "record_type": "source",
      "record_id": "pmid-41629813",
      "action": "created"
    },
    {
      "record_type": "intervention",
      "record_id": "fecal-microbiota-transplantation",
      "action": "created"
    },
    {
      "record_type": "study",
      "record_id": "killifish-young-microbiota-lifespan",
      "action": "created"
    },
    {
      "record_type": "study",
      "record_id": "progeroid-mouse-fmt-healthspan-lifespan",
      "action": "created"
    },
    {
      "record_type": "study",
      "record_id": "young-aged-mouse-fmt-gut-eye-brain",
      "action": "created"
    },
    {
      "record_type": "study",
      "record_id": "fmt-old-mouse-frailty-gut-muscle-axis",
      "action": "created"
    },
    {
      "record_type": "study",
      "record_id": "young-trained-donor-fmt-old-mouse-cognition",
      "action": "created"
    },
    {
      "record_type": "study",
      "record_id": "young-fmt-old-mouse-metabolic-frailty",
      "action": "created"
    },
    {
      "record_type": "study",
      "record_id": "lean-donor-fmt-metabolic-syndrome",
      "action": "created"
    },
    {
      "record_type": "study",
      "record_id": "older-adult-cdi-fmt-case-series",
      "action": "created"
    },
    {
      "record_type": "study",
      "record_id": "fmt-strain-engraftment-meta-analysis",
      "action": "created"
    },
    {
      "record_type": "study",
      "record_id": "fmt-capsules-aging-frailty-trial",
      "action": "created"
    },
    {
      "record_type": "study",
      "record_id": "armor-young-donor-fmt-resilient-aging",
      "action": "created"
    },
    {
      "record_type": "finding",
      "record_id": "young-microbiota-extended-killifish-lifespan",
      "action": "created"
    },
    {
      "record_type": "finding",
      "record_id": "wild-type-fmt-extended-progeroid-mouse-healthspan-lifespan",
      "action": "created"
    },
    {
      "record_type": "finding",
      "record_id": "young-fmt-reversed-aged-mouse-gut-eye-brain-inflammation",
      "action": "created"
    },
    {
      "record_type": "finding",
      "record_id": "fmt-attenuated-old-mouse-frailty-gut-muscle-axis",
      "action": "created"
    },
    {
      "record_type": "finding",
      "record_id": "young-trained-fmt-improved-old-mouse-cognition",
      "action": "created"
    },
    {
      "record_type": "finding",
      "record_id": "young-fmt-improved-old-mouse-frailty-grip-metabolism",
      "action": "created"
    },
    {
      "record_type": "finding",
      "record_id": "lean-donor-fmt-increased-insulin-sensitivity-metabolic-syndrome",
      "action": "created"
    },
    {
      "record_type": "finding",
      "record_id": "older-adult-cdi-fmt-safety-disease-boundary",
      "action": "created"
    },
    {
      "record_type": "finding",
      "record_id": "fmt-engraftment-variable-across-human-diseases",
      "action": "created"
    },
    {
      "record_type": "finding",
      "record_id": "aging-fmt-capsules-trial-recruiting-no-results",
      "action": "created"
    },
    {
      "record_type": "finding",
      "record_id": "armor-young-donor-fmt-protocol-no-results",
      "action": "created"
    },
    {
      "record_type": "outlook",
      "record_id": "track-ecosystem-replacement-outlook",
      "action": "created"
    }
  ],
  "affected_outlook_ids": [
    "track-ecosystem-replacement-outlook"
  ],
  "approving_evidence_review_ids": [
    "evidence-review-ecosystem-replacement-interpretation-forecast-r1",
    "evidence-review-ecosystem-replacement-source-fidelity-r1"
  ],
  "change_note": "Publishing this bundle would establish the first public ecosystem replacement baseline at low-confidence human_biomarker_signal, with direct aging benefit still animal-led and human aging trials still no-results."
}
