{
  "schema_version": "1.0.0",
  "record_type": "publication_event",
  "id": "publish-circulating-factor-modulation-bootstrap-2026-05-31-2026-05-31t17-57-33-932z",
  "name": "Published Circulating factor modulation baseline review for May 31, 2026",
  "summary": "Revised baseline-review update establishing the first public baseline for the circulating factor modulation track.",
  "candidate_bundle_id": "circulating-factor-modulation-bootstrap-2026-05-31",
  "event_type": "publish",
  "published_at": "2026-05-31T17:57:33.932Z",
  "published_by": "tyler",
  "published_targets": [
    {
      "record_type": "source",
      "record_id": "pmid-15716955",
      "action": "created"
    },
    {
      "record_type": "source",
      "record_id": "pmid-28424512",
      "action": "created"
    },
    {
      "record_type": "source",
      "record_id": "pmid-32474458",
      "action": "created"
    },
    {
      "record_type": "source",
      "record_id": "pmid-35999337",
      "action": "created"
    },
    {
      "record_type": "source",
      "record_id": "pmid-40424097",
      "action": "created"
    },
    {
      "record_type": "source",
      "record_id": "pmid-30383097",
      "action": "created"
    },
    {
      "record_type": "source",
      "record_id": "pmid-32715623",
      "action": "created"
    },
    {
      "record_type": "source",
      "record_id": "pmid-34032859",
      "action": "created"
    },
    {
      "record_type": "study",
      "record_id": "heterochronic-parabiosis-aged-progenitor-rejuvenation",
      "action": "created"
    },
    {
      "record_type": "study",
      "record_id": "human-cord-plasma-timp2-aged-mouse-hippocampus",
      "action": "created"
    },
    {
      "record_type": "study",
      "record_id": "neutral-blood-exchange-plasma-dilution-mice-human-tpe",
      "action": "created"
    },
    {
      "record_type": "study",
      "record_id": "repeated-tpe-human-biological-age-proteome",
      "action": "created"
    },
    {
      "record_type": "study",
      "record_id": "randomized-tpe-multiomics-healthy-adults",
      "action": "created"
    },
    {
      "record_type": "study",
      "record_id": "plasma-for-alzheimer-young-plasma-trial",
      "action": "created"
    },
    {
      "record_type": "study",
      "record_id": "ambar-plasma-exchange-alzheimers-trial",
      "action": "created"
    },
    {
      "record_type": "study",
      "record_id": "hsc-refractory-bloodborne-rejuvenation",
      "action": "created"
    },
    {
      "record_type": "finding",
      "record_id": "young-systemic-environment-rejuvenated-aged-progenitors",
      "action": "created"
    },
    {
      "record_type": "finding",
      "record_id": "human-cord-plasma-revitalized-aged-mouse-hippocampus",
      "action": "created"
    },
    {
      "record_type": "finding",
      "record_id": "plasma-dilution-rejuvenated-aged-mouse-tissues",
      "action": "created"
    },
    {
      "record_type": "finding",
      "record_id": "tpe-shifted-human-proteome-and-immune-markers-younger",
      "action": "created"
    },
    {
      "record_type": "finding",
      "record_id": "randomized-tpe-improved-biological-age-markers",
      "action": "created"
    },
    {
      "record_type": "finding",
      "record_id": "young-plasma-ad-safety-feasibility-limited-efficacy",
      "action": "created"
    },
    {
      "record_type": "finding",
      "record_id": "ambar-plasma-exchange-slowed-ad-functional-decline",
      "action": "created"
    },
    {
      "record_type": "finding",
      "record_id": "aged-hsc-refractory-to-bloodborne-rejuvenation",
      "action": "created"
    },
    {
      "record_type": "outlook",
      "record_id": "track-circulating-factor-modulation-outlook",
      "action": "created"
    }
  ],
  "affected_outlook_ids": [
    "track-circulating-factor-modulation-outlook"
  ],
  "approving_evidence_review_ids": [
    "evidence-review-circulating-factor-modulation-interpretation-forecast-r2",
    "evidence-review-circulating-factor-modulation-source-fidelity-r2"
  ],
  "change_note": "Create the first public track outlook at evidence that human function improves with mixed momentum and a tentative read because human functional evidence is Alzheimer disease-specific while healthy-aging evidence remains biomarker-level."
}
